,titles,cleaned_contents
0,Faedah Sirah Nabi: Umar bin Al-Khaththab Masuk Islam #01,"Bagaimana dahulunya Umar bin Al-Khaththab masuk Islam?Dahulunya sebelum masuk Islam, Umar bin Al-Khatthab radhiyallahu ‘anhusangat memusuhi dan sering menyakiti kaum muslimin. Hal ini sebagaimana dikatakan oleh Laila binti Hatsmah bin Abdullah istri Amir bin Rabi’ah radhiyallahu ‘anhu,“Demi Allah, ketika kami hendak berangkat untuk berhijrah ke negeri Habasyah. Pada saat itu, Amir bin Rabi’ah pergi untuk suatu keperluan, tiba-tiba Umar yang masih musyrik, datang dan berdiri di hadapanku, padahal sebelumnya kami sering mendapatkan perlakuan kasar darinya, ia suka menyakiti dan mengganggu kami. Akan tetapi pada saat itu, ia berkata, ‘Benarkah kalian akan berangkat, wahai Ummu Abdillah?’Aku jawab, ‘Ya demi Allah, kami akan berjalan di bumi Allah, sebab kalian selalu menyakiti dan menindas kami, mudah-mudahan kelak Allah akan memberikan jalan keluar terbaik bagi kami.’ Umar berkata, ‘Semoga Allah bersama kalian.’ Sungguh aku melihat sikap lembut Umar yang belum pernah aku lihat selama ini. Kemudian ia pergi dan aku melihat ia merasa sedih atas kepergian kami.Ketika Amir bin Rabi’ah datang dari menunaikan keperluannya, aku berkata kepadanya, ‘Hai Abu Abdillah, seandainya kamu tadi ada, kamu akan melihat sikap lunak dan kesedihan Umar atas kepergian kita ini.’ Amir berkata, ‘Apakah kamu berharap ia masuk Islam?’ Aku menjawab, ‘Ya.’ Ia berkata, ‘Sungguh orang yang kamu lihat tadi tidak akan masuk Islam sampai keledai Al-Khaththab masuk Islam.’ Amir merasa bahwa tidak ada harapan atas Umar akan masuk Islam, karena sikap keras dan kasarnya selama ini terhadap Islam.” (Disebutkan oleh Ibnu Hisyam, Sirah Nabawiyah, 1:365; Ibnu Hajar, Al-Ishabah, 8:180-181; Al-Haitsami berkata dalam Majma’ Az-Zawaid, 6:24, diriwayatkan oleh Ath-Thabrani, dan Ibnu Ishaq telah berterus terang bahwa ia meriwayatkannya dengan mendengar langsung, jadi riwayat ini shahih).Pada peristiwa ini terlihat sikap lunak Umar bin Al-Khaththab radhiyallahu ‘anhuyang tidak biasanya ia lakukan kepada orang Islam selama ini. Itulah yang membuat Amir bin Rabi’ah radhiyallahu ‘anhutidak percaya apa yang diceritakan oleh istrinya, sebab biasanya Umar radhiyallahu ‘anhubersikap kasar sehingga atas dasar itu, Amir bin Rabi’ah radhiyallahu ‘anhumerasa tidak mungkin Umar akan masuk Islam.Karena kedudukan Umar bin Al-Khaththab radhiyallahu ‘anhuyang sangat penting di tengah bangsa Quraisy, maka Rasulullah shallallahu ‘alaihi wa sallamberdoa kepada Allah Ta’alasecara khusus yang ditujukan kepada Umar dan Abu Jahal, agar Allah memberi petunjuk kepada salah satu dari mereka yang paling dicintai oleh Allah untuk Islam.Diriwayatkan dari Ibnu Umar radhiyallahu ‘anhumabahwa Rasulullahshallallahu ‘alaihi wa sallamberdoa,« اللَّهُمَّ أَعِزَّ الإِسْلاَمَ بِأَحَبِّ هَذَيْنِ الرَّجُلَيْنِ إِلَيْكَ بِأَبِى جَهْلٍ أَوْ بِعُمَرَ بْنِ الْخَطَّابِ ». قَالَ وَكَانَ أَحَبَّهُمَا إِلَيْهِ عُمَرُ“Ya Allah, muliakanlah Islam dengan salah seorang yang lebih Engkau cintai dari kedua laki-laki ini: Abu Jahal atau Umar bin Al-Khaththab.” Sang perawi mengatakan, ternyata yang lebih dicintai oleh Allah adalah Umar. (HR. Tirmidzi, no. 3681; Ahmad, 2:95. Al-Hafizh Abu Thahir mengatakan bahwa hadits ini hasan).Dari Ibnu ‘Abbas radhiyallahu ‘anhuma, Nabi shallallahu ‘alaihi wa sallamberdoa,« اللَّهُمَّ أَعِزَّ الإِسْلاَمَ بِأَبِى جَهْلِ بْنِ هِشَامٍ أَوْ بِعُمَرَ ». قَالَ فَأَصْبَحَ فَغَدَا عُمَرُ عَلَى رَسُولِ اللَّهِ -صلى الله عليه وسلم- فَأَسْلَمَ.“Ya Allah, muliakanlah Islam dengan Abu Jahal bin Hisyam atau lewat Umar.” Maka datang pagi, lantas Umar radhiyallahu ‘anhumendatangi Rasulullah shallallahu ‘alaihi wa sallamkemudian masuk Islam. (HR. Tirmidzi, no. 3683. Al-Hafizh Abu Thahir mengatakan bahwa hadits ini sanadnya dhaif).Dan dari Aisyah radhiyallahu ‘anha, ia berkata, Rasulullah shallallahu ‘alaihi wa sallambersabda,اللَّهُمَّ أَعِزَّ الإِسْلاَمَ بِعُمَرَ بْنِ الْخَطَّابِ خَاصَّةً“Ya Allah, muliakanlah Islam dengan Umar bin Al-Khaththab secara khusus.” (HR. Ibnu Majah, no. 105. Al-Hafizh Abu Thahir mengatakan bahwa hadits ini sanadnya dhaif).Allah Ta’alabenar-benar mengabulkan doa Rasul-Nya shallallahu ‘alaihi wa sallamyang menyebabkan Umar bin Al-Khaththab radhiyallahu ‘anhuberiman pasca peristiwa hijrah ke Habasyah tahap pertama. Pada sebuah riwayat disebutkan bahwa Umar masuk Islam tiga hari setelah Hamzah radhiyallahu ‘anhumasuk Islam.Bersambung insya Allah pada serial berikutnya tentang kisah masuk Islamnya Umar dan pelajaran di dalamnya.Fiqh As-Sirah.Cetakan Tahun 1424 H. Prof. Dr.Zaid bin Abdul Karim Az-Zaid. Penerbit Dar At-Tadmuriyyah.—Disusun di Pesantren Darush Sholihin,15 Rabi’ul Awwal 1440 HOleh: Muhammad Abduh TuasikalArtikel Rumaysho.Com"
1,Masuk Surga Berkat Keshalihan Orang Tua,"Masuk surga bisa bersama orang tua kita yang beriman, bahkan kalau anak kurang dalam beramal, keshalihan orang tua akan mengangkat anaknya. Ingat, asalkan beriman dan bertauhid.
Allah Ta’alaberfirman,وَالَّذِينَ آمَنُوا وَاتَّبَعَتْهُمْ ذُرِّيَّتُهُمْ بِإِيمَانٍ أَلْحَقْنَا بِهِمْ ذُرِّيَّتَهُمْ وَمَا أَلَتْنَاهُمْ مِنْ عَمَلِهِمْ مِنْ شَيْءٍ ۚكُلُّ امْرِئٍ بِمَا كَسَبَ رَهِينٌ“Dan orang-oranng yang beriman, dan yang anak cucu mereka mengikuti mereka dalam keimanan, Kami hubungkan anak cucu mereka dengan mereka, dan Kami tiada mengurangi sedikitpun dari pahala amal mereka. Tiap-tiap manusia terikat dengan apa yang dikerjakannya.” (QS. Ath-Thuur: 21)Syaikh ‘Abdurrahman bin Nashir As-Sa’di rahimahullahmenjelaskan bahwa di antara kesempurnaan kenikmatan bagi penduduk surga, Allah menghubungkan antara keturunan yang beriman dengan orang tua mereka. Anak-anak tersebut akan dihubungkan dengan orang tuanya dalam keimanan (walaupun keimanan anak-anak tersebut kurang, pen.). Lebih-lebih jika anak-anak tersebut memiliki iman (yang lebih), tentu akan lebih selamat. Allah akan mengangkat derajat anak-anak tadi sederajat dengan orang tua mereka, walaupun keimanan mereka tidak bisa menggapai orang tuanya. Itulah balasan untuk orang tua mereka, sebagai karunia juga untuk orang tua mereka. Namun hal tersebut tidaklah membuat Allah mengurangi pahala amalan orang tua mereka.Demikian penjelasan Syaikh As-Sa’di dalam kitab tafsirnya, Taisir Al-Karim Ar-Rahmanatau disebut pula Tafsir As-Sa’di.Disebutkan dalam Tafsir Ath-Thabaridalam sebagian penjelasannya, yang dimaksud adalah mengikuti di atas tauhid dalam beriman.Apakah jika orang tua masuk neraka, anak akan ikut orang tua pula?Ingatlah antara surga dan neraka bukanlah dalam satu hukum yang sama. Neraka adalah tempat ditetapkannya hukum keadilan (sedangkan masuk surga itu karena karunia Allah, pen.). Termasuk keadilan adalah Allah akan memberikan hukuman kepada seorang hamba karena dosa. Makanya dikatakan dalam ayat di atas bahwa amalan setiap orang akan tergadai. Artinya, setiap orang tidaklah mewariskan dosa pada lainnya dan seseorang tidaklah memikul dosa lainnya.Lihat penjelasan Syaikh As-Sa’di dalam kitab tafsirnya.Dalam Tafsir Al-Qur’an Al-‘Azhim karya Imam Ibnu Katsir, Ibnu ‘Abbas radhiyallahu ‘anhuma berkata, “Allah akan mengangkat derajat dari keturunan seorang mukmin, walaupun anak keturunannya kalah dalam beramal. Hal ini punya tujuan untuk jadi penyejuk mata bagi orang tuanya.”Imam Ibnu Katsir rahimahullah menyatakan bahwa ayat ini menunjukkan bagaimanakah berkahnya amal orang tua terhadap anak. Adapun manfaat dari anak terhadap orang tuanya adalah ia terus mendoakan orang tuanya.Ada hadits dikeluarkan oleh Imam Ahmad dengan sanad shahih menurut Imam Ibnu Katsir dalam tafsir ayat ini, “Allah meninggikan derajat seorang hamba yang shalih di surga.” Lantas ia berkata, “Wahai Rabbku, apakah surga ini untukku?” Dijawab, “Engkau masuk surga berkat permintaan ampun dari anakmu untukmu.”Semoga setiap orang tua dibekali keimanan dan kita pun dikaruniai anak yang menjadi penyejuk mata. Wallahu waliyyut taufiq was sadaad, hanya Allah yang memberi taufik dan hidayah.Tafsir Ath-Thabari karya Ibnu Jarir Ath-Thabari, Tafsir Al-Qur’an Al-‘Azhimkarya Ibnu Katsir, dan Tafsir As-Sa’dikarya Syaikh ‘Abdurrahman bin Nashir As-Sa’di, aplikasi di iPad dikeluarkan oleh www.pakdata.com.—Ditulis saat menjelang Shubuh pada penerbangan pulang dengan Saudia Airlines, 13 Shafar 1440 H (Senin, 22 Oktober 2018), perjalanan Jeddah – JakartaOleh: Muhammad Abduh Tuasikal"
2,"Syarhus Sunnah: Allah itu Al-‘Alim, Al-Khabiir (Yang Maha Mengetahui)","Seorang muslim mesti juga mengimani Allah itu Maha Mengetahui segala sesuatu, Al-‘Aliim, Al-Khabiir.Imam Al-Muzani rahimahullahberkata,الوَاحِدُ الصَّمَدُلَيْسَ لَهُ صَاحِبَةٌ وَلاَ وَلَدٌ جَلَّ عَنِ المَثِيْلِ فَلاَ شَبِيْهَ لَهُ وَلاَ عَدِيْلَ السَّمِيْعُ البَصِيْرُ العَلِيْمُ الخَبِيْرُ المَنِيْعُ الرَّفِيْعُAda di 175 tempat penyebutan nama Allah Al-‘Alim (Yang Maha Mengetahui) dalam Al-Qur’an seperti pada firman Allah,قَالُوا سُبْحَانَكَ لَا عِلْمَ لَنَا إِلَّا مَا عَلَّمْتَنَا ۖإِنَّكَ أَنْتَ الْعَلِيمُ الْحَكِيمُ“Mereka menjawab: ‘Maha Suci Engkau, tidak ada yang kami ketahui selain dari apa yang telah Engkau ajarkan kepada kami; sesungguhnya Engkaulah Yang Maha Mengetahui lagi Maha Bijaksana’.” (QS. Al-Baqarah: 32)وَاللَّهُ عَلِيمٌ بِذَاتِ الصُّدُورِ“Allah Maha Mengetahui isi hati.” (QS. Ali Imran: 154)قَالَ رَبِّي يَعْلَمُ الْقَوْلَ فِي السَّمَاءِ وَالْأَرْضِ ۖوَهُوَ السَّمِيعُ الْعَلِيمُ“Berkatalah Muhammad (kepada mereka): ‘Rabbku mengetahui semua perkataan di langit dan di bumi dan Dialah Yang Maha Mendengar lagi Maha Mengetahui’.” (QS. Al-Anbiya’: 4)Al-Khabiir punya makna bahwa Allah mengetahui berbagai rahasia yang tersembunyi, apa yang ada dalam batin secara detail diketahui oleh Allah, dan segala sesuatu secara rinci diketahui oleh Rabb kita.Imam Ibnu Jarir menyebutkan bahwa Al-Khabiir maksudnya adalah Allah Maha Mengetahui segala rahasia hamba, Maha Mengetahui segala sesuatu yang tersembunyi dalam hati, dan segala sesuatu tidak samar bagi Allah. Lihat Jami’ Al-Bayan, 28:103, dinukil dari An–Nahju Al-Asma’ fi Syarh Asma’ Allah Al-Husna, hlm. 187.Penyebutan nama Allah Al-Khabiir ada di 45 tempat dalam Al-Qur’an seperti dalam ayat,قَالَ نَبَّأَنِيَ الْعَلِيمُ الْخَبِيرُ“Telah diberitahukan kepadaku oleh Allah yang Maha Mengetahui lagi Maha Mengenal.”(QS. At-Tahrim: 3)إِنَّ رَبَّهُمْ بِهِمْ يَوْمَئِذٍ لَخَبِيرٌ“Sesungguhnya Rabb mereka pada hari itu Maha Mengetahui keadaan mereka.” (QS. Al-‘Adiyat: 11)Pertama: Penetapan bahwa Allah memiliki ilmu yang sempurna dan meliputi segala sesuatu, dan itu hanya dimiliki oleh Allah, tidak ada satu makhluk pun yang mengetahui sesempurna ilmu Allah. Hal ini seperti disebutkan dalam ayat tentang perkara ghaib,وَعِنْدَهُ مَفَاتِحُ الْغَيْبِ لَا يَعْلَمُهَا إِلَّا هُوَ ۚوَيَعْلَمُ مَا فِي الْبَرِّ وَالْبَحْرِ ۚوَمَا تَسْقُطُ مِنْ وَرَقَةٍ إِلَّا يَعْلَمُهَا وَلَا حَبَّةٍ فِي ظُلُمَاتِ الْأَرْضِ وَلَا رَطْبٍ وَلَا يَابِسٍ إِلَّا فِي كِتَابٍ مُبِينٍ“Dan pada sisi Allah-lah kunci-kunci semua yang ghaib; tidak ada yang mengetahuinya kecuali Dia sendiri, dan Dia mengetahui apa yang di daratan dan di lautan, dan tiada sehelai daun pun yang gugur melainkan Dia mengetahuinya (pula), dan tidak jatuh sebutir biji-pun dalam kegelapan bumi, dan tidak sesuatu yang basah atau yang kering, melainkan tertulis dalam kitab yang nyata (Lauh Mahfudz).” (QS. Al-An’am: 59)Kedua: Allah Yang Maha Mengetahui berarti tahu segala sesuatu yang telah terjadi, yang akan terjadi, dan tidak terjadi seandainya itu terjadi. Sebagaimana disebutkan dalam ayat,أَلَمْ تَعْلَمْ أَنَّ اللَّهَ يَعْلَمُ مَا فِي السَّمَاءِ وَالْأَرْضِ ۗإِنَّ ذَٰلِكَ فِي كِتَابٍ ۚإِنَّ ذَٰلِكَ عَلَى اللَّهِ يَسِيرٌ“Apakah kamu tidak mengetahui bahwa sesungguhnya Allah mengetahui apa saja yang ada di langit dan di bumi?; bahwasanya yang demikian itu terdapat dalam sebuah kitab (Lauh Mahfuzh). Sesungguhnya yang demikian itu amat mudah bagi Allah.” (QS. Al-Hajj: 70)Ketiga: Makhluk tidak mengetahui tentang Sang Khaliq kecuali yang Dia kabarkan saja. Secara umum pula kita tidak tahu apa pun kecuali yang Allah ajarkan pada kita. Sebagaimana disebutkan dalam ayat,يَعْلَمُ مَا بَيْنَ أَيْدِيهِمْ وَمَا خَلْفَهُمْ وَلَا يُحِيطُونَ بِهِ عِلْمًا“Allah mengetahui apa yang ada di hadapan mereka dan apa yang ada di belakang mereka, sedang ilmu mereka tidak dapat meliputi ilmu-Nya.” (QS. Thaha: 110)Sebagaimana Nabi Adam diajarkan ilmu,وَعَلَّمَ آدَمَ الْأَسْمَاءَ كُلَّهَا ثُمَّ عَرَضَهُمْ عَلَى الْمَلَائِكَةِ فَقَالَ أَنْبِئُونِي بِأَسْمَاءِ هَٰؤُلَاءِ إِنْ كُنْتُمْ صَادِقِينَ“Dan Allah mengajarkan kepada Adam nama-nama (benda-benda) seluruhnya, kemudian mengemukakannya kepada para Malaikat lalu berfirman: “Sebutkanlah kepada-Ku nama benda-benda itu jika kamu mamang benar orang-orang yang benar!” (QS. Al-Baqarah: 31)Keempat: Ilmu manusia dibanding dengan ilmu Allah sangatlah jauh berbeda. Allah Ta’alaberfirman,وَيَسْأَلُونَكَ عَنِ الرُّوحِ ۖقُلِ الرُّوحُ مِنْ أَمْرِ رَبِّي وَمَا أُوتِيتُمْ مِنَ الْعِلْمِ إِلَّا قَلِيلًا“Dan mereka bertanya kepadamu tentang roh. Katakanlah: ‘Roh itu termasuk urusan Tuhan-ku, dan tidaklah kamu diberi pengetahuan melainkan sedikit’.” (QS. Al-Isra’: 85)Kelima: Hanya Allah yang mengetahui perkara ghaib seperti disebutkan dalam ayat lainnya selain ayat yang disebutkan di atas,إِنَّ اللَّهَ عِنْدَهُ عِلْمُ السَّاعَةِ وَيُنَزِّلُ الْغَيْثَ وَيَعْلَمُ مَا فِي الْأَرْحَامِ ۖوَمَا تَدْرِي نَفْسٌ مَاذَا تَكْسِبُ غَدًا ۖوَمَا تَدْرِي نَفْسٌ بِأَيِّ أَرْضٍ تَمُوتُ ۚإِنَّ اللَّهَ عَلِيمٌ خَبِيرٌ“Sesungguhnya Allah, hanya pada sisi-Nya sajalah pengetahuan tentang Hari Kiamat; dan Dialah Yang menurunkan hujan, dan mengetahui apa yang ada dalam rahim. Dan tiada seorang pun yang dapat mengetahui (dengan pasti) apa yang akan diusahakannya besok. Dan tiada seorangpun yang dapat mengetahui di bumi mana dia akan mati. Sesungguhnya Allah Maha Mengetahui lagi Maha Mengenal.” (QS. Luqman: 34)Pertama: Penetapan bahwa Allah Maha Mengetahui segala sesuatu secara detail dan sampai mengetahui yang tersembunyi.Kedua: Allah mengetahui amalan hamba baik berupa perkataan maupun perbuatan, termasuk yang ada dalam batin berupa kebaikan dan kejelekan. Sebagaimana disebutkan dalam ayat,أَلَا يَعْلَمُ مَنْ خَلَقَ وَهُوَ اللَّطِيفُ الْخَبِيرُ“Apakah Allah Yang menciptakan itu tidak mengetahui (yang kamu lahirkan atau rahasiakan); dan Dia Maha Halus lagi Maha Mengetahui?” (QS. Al-Mulk: 14)Moga semakin manfaat dengan terus merenungkan nama dan sifat Allah.—Diselesaikan di Pesantren Darush Sholihin, Selasa sore, 14 Shafar 1440 HOleh: Muhammad Abduh TuasikalArtikel Rumaysho.Com"
