,titles,cleaned_contents
23,Bermimpi Bertemu Nabi dan Terapi Mimpi Buruk,"Kali ini kita akan kaji hadits yang membicarakan tentang mimpi bertemu nabi dan terapi mimpi buruk.بَابُ الرُّؤْيَا وَمَا يَتَعَلَّقُ بِهَاوَعَنْهُ قَالَ: قالَ رَسُوْلُ اللهِ صَلَّى اللهُ عَلَيْهِ وَسَلَّمَ: “مَنْ رَآنِي فِي المنَامِ فَسَيَرَانيِ فِي الَيَقَظَةِ أوْ كأنَّمَا رَآنِي فِي اليَقَظَةِ لايَتَمثَّلُ الشَّيْطانُ بي”. مُتَّفَقٌ عَلَيهِ.Dari Abu Hurairah radhiyallahu ‘anhu, Rasulullah shallallahu ‘alaihi wa sallambersabda, “Barangsiapa yang melihatku dalam tidurnya, maka ia akan melihatku dalam sadarnya—atau seolah ia melihatku dalam sadarnya—karena setan tidak bisa menyerupaiku.” (Muttafaqun ‘alaih) [HR. Bukhari, no. 6993 dan Muslim, no. 2266]وَعَنْ أَبي سَعِيْدٍ الخُدْرِيِّ رَضِيَ اللهُ عَنْهُ أنَّه سمِع النَّبيَّ صَلّى اللهُ عَلَيْهِ وسَلَّم يقول: “إِذَا رَأى أَحدُكُم رُؤْيَا يُحبُّهَا فَإنَّما هِيَ مِنَ اللهِ تَعَالَى فَليَحْمَدِ اللهَ عَلَيهَا وَلْيُحُدِّثْ بِها وفي رواية: فَلا يُحَدِّثْ بَها إِلاَّ مَنْ يُحِبُّ وَإذا رَأَى غَيَر ذَلك مِمَّا يَكرَهُ فإنَّما هِيَ منَ الشَّيْطانِ فَليَسْتَعِذْ منْ شَرِّهَا وَلا يَذكْرها لأَحَدٍ فَإنَّهَا لاَ تَضُرُّهُ” متفقٌ عَلَيْهِ.Dari Abu Sa’id Al-Khudri radhiyallahu ‘anhu, Nabi shallallahu ‘alaihi wa sallambersabda, “Apabila salah seorang di antara kalian bermimpi sesuatu yang disukainya, bahwasanya mimpi itu berasal dari Allah, maka pujilah Allah karenanya, dan ceritakanlah hal itu.”—Di dalam riwayat lain disebutkan, maka janganlah ia menceritakan mimpinya kecuali kepada orang yang menyukainya–. “Dan apabila ia bermimpi sesuatu yang tidak ia sukai, bahwasanya mimpi itu berasal dari setan, maka mintalah perlindungan dari kejelekannya dan janganlah ia menceritakannya kepada siapa pun, niscaya mimpi itu tidak akan membahayakannya.” (Muttafaqun ‘alaih) [HR. Bukhari, no. 6985. Hadits ini yang tepat tidak dikeluarkan oleh Muslim]وعن أَبي قَتَادَة رضي الله عنه قَالَ: قَالَ النبيُّ صَلّى اللهُ عَلَيْهِ وسَلَّم: ” الرُّؤْيَا الصَّالَحِةُ وفي رواية الرُّؤيَا الحَسَنَةُ منَ اللهِ، والحُلُم مِنَ الشَّيْطَان، فَمَن رَأى شَيْئاً يَكرَهُهُ فَلْيَنْفُثْ عَن شِمَاله ثَلاَثاً، ولْيَتَعَوَّذْ مِنَ الشَّيْطَانِ فَإنَّها لاَ تَضُرُّهُ” مُتَّفَقٌ عَلَيْهِ.”النَّفثُ”نَفخٌ لطيفٌ لاريِقَ مَعَهُDari Abu Qatadah radhiyallahu ‘anhu, ia berkata bahwa Nabi shallallahu ‘alaihi wa sallambersabda, “Mimpi yang baik (shalihah)–dalam riwayat lain, mimpi yang indah (hasanah)—itu berasal dari Allah, dan mimpi buruk itu dari setan. Barangsiapa yang bermimpi sesuatu yang tidak disukainya, hendaklah ia meludah ke sebelah kirinya tiga kali dan mintalah perlindungan kepada Allah dari kejahatan setan, niscaya mimpi itu tidak akan membahayakannya.” (Muttafaqun ‘alaih) [HR. Bukhari, no. 3292 dan Muslim, no. 2261]An-naftsuadalah hembusan nafas yang halus tanpa disertai air ludah.وَعَنْ جَابِرٍ رَضِيَ اللهُ عَنْهُ عَنْ رَسُولِ الله صَلّى اللهُ عَلَيْهِ وسَلَّم قَالَ: “إذَا رَأى أحَدُكُم الرُّؤيا يَكْرَهُها فلْيبصُقْ عَن يَسَارِهِ ثَلاَثاً، وْليَسْتَعِذْ بِاللهِ مِنَ الشَّيَطانِ ثَلاثاَ، وليَتَحوَّل عَنْ جَنْبِهِ الَّذِي كَانَ عَلَيْهِ “رواه مسلم.Dari Jabir radhiyallahu ‘anhu, Rasulullah shallallahu ‘alaihi wa sallambersabda, “Apabila salah seorang di antara kalian bermimpi sesuatu yang dibencinya, hendaklah ia meludah ke sebelah kirinya tiga kali, dan mintalah perlindungan kepada Allah dari setan sebanyak tiga kali. Setelah itu, ubahlah posisi tidurnya dari posisi sebelumnya ke posisi lainnya.” (HR. Muslim) [HR. Muslim, no. 2262]Hadits ini mengajarkan terapi ketika menghadapi mimpi buruk:وَعَنْ أَبِي الأَسْقَعِ وَاثِلةَ بْنِ الأَسْقَعِ رضي الله عنه قال: قال رسول الله صَلّى اللهُ عَلَيْهِ وسَلَّم: “إنَّ مِنْ أعظَم الفَرى أنْ يَدَّعِي الرَّجُلُ إِلَى غَيْرِ أبِيه، أوْ يُري عَيْنهُ مَالم تَرَ، أوْ يقولَ عَلَى رسول الله صَلّى اللهُ عَلَيْهِ وسَلَّم مَا لَمْ يَقُلْ” رواه البخاري.Dari Abu Al-Asqa Watsiah bin Al-Asqa’ radhiyallahu ‘anhuberkata, “Rasulullahshallallahu ‘alaihi wa sallambersabda, ‘Sesungguhnya di antara kebohongan terbesar adalah seseorang mengaku-ngaku nasab kepada selain ayahnya, atau orang mengatakan ia memimpikan sesuatu padahal ia tidak memimpikannya, atau orang yang berkata atas nama Rasulullah shallallahu ‘alaihi wa sallam padahal beliau tidak mengatakannya.’” (HR. Bukhari) [HR. Bukhari, no. 3509]Bahjah An-Nazhirin Syarh Riyadh Ash-Shalihin. Cetakan pertama, Tahun 1430 H. Syaikh Salim bin ‘Ied Al-Hilali. Penerbit Dar Ibnul Jauzi.—Diselesaikan di Pesantren Darush Sholihin, Panggang, Gunungkidul,malam 22 Dzulhijjah 1439 HOleh: Muhammad Abduh TuasikalArtikel Rumaysho.Com"
24,Menggali Adab dari Surah An-Nuur #02,"Bahasan ini bagus untuk dipelajari karena menghimpun akhlak-akhlak yang mulia dan bekal yang bagus bagi setiap muslim/muslimah. Ini lanjutan dari bahasan sebelumnya.Menggali Pelajaran Adab dari Surat An-NuurDalam ayat disebutkan,إِنَّ الَّذِينَ يَرْمُونَ الْمُحْصَنَاتِ الْغَافِلَاتِ الْمُؤْمِنَاتِ لُعِنُوا فِي الدُّنْيَا وَالْآَخِرَةِ وَلَهُمْ عَذَابٌ عَظِيمٌ“Sesungguhnya orang-orang yang menuduh wanita yang baik-baik, yang lengah lagi beriman (berbuat zina), mereka kena la’nat di dunia dan akhirat, dan bagi mereka azab yang besar.”Ada tiga sifat yang disebutkan dalam ayat ini:Allah Ta’alaberfirman,يَا أَيُّهَا الَّذِينَ آَمَنُوا لَا تَدْخُلُوا بُيُوتًا غَيْرَ بُيُوتِكُمْ حَتَّى تَسْتَأْنِسُوا وَتُسَلِّمُوا عَلَى أَهْلِهَا ذَلِكُمْ خَيْرٌ لَكُمْ لَعَلَّكُمْ تَذَكَّرُونَ“Hai orang-orang yang beriman, janganlah kamu memasuki rumah yang bukan rumahmu sebelum meminta izin dan memberi salam kepada penghuninya. Yang demikian itu lebih baik bagimu, agar kamu (selalu) ingat.” (QS. An-Nuur: 27)Beberapa hadits yang mengajarkan adab meminta izin adalah sebagai berikut.Dari Abu Musa Al-Asy’ari radhiyallahu ‘anhu, ia berkata bahwa Rasulullah shallallahu ‘alaihi wa sallambersabda,الاسْتِئْذَانُ ثَلاثٌ ، فَإنْ أُذِنَ لَكَ وَإِلاَّ فَارْجِعْ“Meminta izin itu tiga kali. Maka, jika diizinkan, engkau boleh masuk, dan jika tidak maka kembalilah.” (HR. Bukhari, no. 6245 dan Muslim, no. 2157)Dari Sahl bin Sa’ad radhiyallahu ‘anhu, ia berkata bahwa Rasulullah shallallahu ‘alaihi wa sallambersabda,إنَّمَا جُعِلَ الاسْتِئذَانُ مِنْ أجْلِ البَصَرِ“Sesungguhnya ditetapkannya meminta izin itu hanya karena masalah menjaga pandangan.” (HR. Bukhari, no. 6241 dan Muslim, no. 2156)Dari Rib’i bin Hirasy, ia berkata, “Seorang lelaki dari Bani ‘Amir bercerita kepada kami bahwa ia pernah meminta izin kepada Nabi shallallahu ‘alaihi wa sallamketika beliau ada di rumah. Orang tersebut berkata, ‘Apakah aku boleh masuk?’ Rasulullah shallallahu ‘alaihi wa sallampun berkata kepada pembantunya, ‘Keluarlah kepada orang tersebut, lalu ajarkanlah ia cara meminta izin.’ Ajarkanlah kepadanya, ‘Ucapkanlah assalaamu ‘alaikum, bolehkah aku masuk?’ Orang tersebut pun mendengarnya, lantas ia mengucapkan, ‘Assalamu ‘aaikum, bolehkah aku masuk?’ Lantas Nabi shallallahu ‘alaihi wa sallampun mengizinkannya, setelah itu ia pun masuk.” (HR. Abu Daud, no. 5177 dengan sanad shahih)Dari Kildah bin Al-Hambal radhiyallahu ‘anhu, ia berkata, “Aku pernah mendatangi Nabi shallallahu ‘alaihi wa sallam, aku menemui beliau dan aku ketika itu tidak mengucapkan salam. Nabishallallahu ‘alaihi wa sallamlantas mengatakan,ارْجِعْ فَقُلْ : السَّلاَمُ عَلَيْكُمْ ، أَأَدْخُل ؟‘Kembalilah, lalu ucapkanlah assalaamu ‘alaikum, bolehkah aku masuk?’” (HR. Abu Daud, no. 5176 dan Tirmidzi, no. 2710. Tirmidzi mengatakan bahwa hadits ini hasan)Cara meminta izin adalah dengan memperkenalkan nama.Dari Anas radhiyallahu ‘anhu, di dalam haditsnya yang masyhur tentang isra’. Ia berkata, Rasulullah shallallahu ‘alaihi wa sallam bersabda, “Kemudian Jibril membawaku naik ke langit dunia, ia meminta dibukakan pintunya. Maka ditanya, ‘Siapakah ini?’ Jibril menjawab, ‘Ini Jibril.’ Lalu ditanya lagi, ‘Lalu siapakah yang bersamamu?’ Jibril menjawab, ‘Bersama Muhammad.’ Kemudian naik ke langit kedua, maka ditanya lagi, ‘Siapakah ini?’ Jibril menjawab, ‘Ini Jibril.’ Lalu ditanya lagi, ‘Lalu siapakah yang bersamamu?’ Jibril menjawab, ‘Bersama Muhammad.’ Lalu langit naik ke langit ketiga, keempat, dan lainnya. Di setiap pintu langit ditanya, ‘Siapakah ini?’ Dijawab, ‘Ini Jibril.’” (HR. Muslim, no. 3207 dan Muslim, no. 162)Dari Abu Dzar radhiyallahu ‘anhu, ia berkata, “Aku keluar pada suatu malam. Ternyata, Rasulullah shallallahu ‘alaihi wa sallamsedang berjalan seorang diri. Maka, aku mulai berjalan di bawah sinar bulan. Beliau lalu menoleh, kemudian melihatku. Lalu berkata, ‘Siapakah ini?’ Aku menjawab, ‘Abu Dzar.’ (HR. Bukhari, no. 6443 dan Muslim, no. 94/153)Dari Ummu Hani radhiyallahu ‘anha, ia berkata,أتيتُ النَّبيَّ – صلى الله عليه وسلم – وَهُوَ يَغْتَسِلُ وَفَاطِمَةُ تَسْتُرُهُ ، فَقَالَ : (( مَنْ هذِهِ ؟ )) فقلتُ : أنا أُمُّ هَانِىءٍ“Aku datang kepada Nabi shallallahu ‘alaihi wa sallamketika beliau sedang mandi, dan Fatimah menutupinya. Maka beliau berkata, ‘Siapakah ini?’ Aku menjawab, ‘Ummu Hani.’ (HR. Bukhari, no. 357 dan Muslim, no. 336)Dari Jabir radhiyallahu ‘anhu, ia berkata,أتَيْتُ النبيَّ – صلى الله عليه وسلم – فَدَقَقْتُ البَابَ ، فَقَالَ : (( مَنْ هَذَا ؟ )) فَقُلتُ : أَنَا ، فَقَالَ : (( أنَا ، أنَا ! )) كَأنَّهُ كَرِهَهَ“Aku datang kepada Nabi shallallahu ‘alaihi wa sallam, lalu mengetuk pintu. Maka beliau berkata, ‘Siapakah ini?’ Aku menjawab, ‘Aku.’ Beliau lantas berkata, ‘Aku, aku.’ Seolah beliau membencinya.” (HR. Bukhari, no. 6250 dan Muslim, no. 2155)Apa saja manfaat meminta izin dan mengucapkan salam ketika masuk ke dalam rumah yang bukan rumah kita?Allah Ta’alaberfirman,قُلْ لِلْمُؤْمِنِينَ يَغُضُّوا مِنْ أَبْصَارِهِمْ وَيَحْفَظُوا فُرُوجَهُمْۚذَٰلِكَ أَزْكَىٰ لَهُمْۗإِنَّ اللَّهَ خَبِيرٌ بِمَا يَصْنَعُونَ“Katakanlah kepada orang laki-laki yang beriman, “Hendaklah mereka menahan pandanganya, dan memelihara kemaluannya; yang demikian itu adalah lebih suci bagi mereka, sesungguhnya Allah Maha Mengetahui apa yang mereka perbuat.” (QS. An-Nuur: 30)Syaikh As-Sa’di rahimahullah menyatakan tentang surah An-Nuur ayat 30 di atas, “Siapa yang meninggalkan sesuatu karena Allah, maka Allah ganti dengan yang lebih baik. Siapa yang tundukkan pandangannya dari yang haram, maka Allah akan memberikan cahaya pada penglihatannya.” (Tafsir As-Sa’di, hlm. 596)Dalam hadits disebutkan,إِنَّكَ لَنْ تَدَعَ شَيْئاً لِلَّهِ عَزَّ وَجَلَّ إِلاَّ بَدَّلَكَ اللَّهُ بِهِ مَا هُوَ خَيْرٌ لَكَ مِنْهُ“Sesungguhnya jika engkau meninggalkan sesuatu karena Allah, niscaya Allah akan memberi ganti padamu dengan yang lebih baik.” (HR. Ahmad, 5:363. Syaikh Syu’aib Al-Arnauth mengatakan bahwa sanad hadits ini shahih. Syaikh Salim bin ‘Ied Al-Hilali berkata bahwa sanad hadits ini shahih).Semoga bermanfaat. Hanya Allah yang memberi taufik dan hidayah.—Diselesaikan di perjalanan Jakarta – Jogja, Senin sore, 22 Dzulhijjah 1439 HOleh: Muhammad Abduh TuasikalArtikel Rumaysho.Com"
25,Faedah Surat Yasin: Salam untuk Penduduk Surga,"Ada kalimat salam untuk penduduk surga, dijelaskan dalam surat Yasin berikut ini.Tafsir Surah YasinAyat 58سَلَامٌ قَوْلًا مِنْ رَبٍّ رَحِيمٍ“(Kepada mereka dikatakan), ‘Salam’ sebagai ucapan selamat dari Tuhan Yang Maha Penyayang.” (QS. Yasin: 58)Kata Ibnu ‘Abbasradhiyallahu ‘anhuma, Allah sendiri yang mengucapkan salam kepada penduduk surga. Sebagaimana disebutkan dalam ayat,تَحِيَّتُهُمْ يَوْمَ يَلْقَوْنَهُ سَلَامٌ ۚوَأَعَدَّ لَهُمْ أَجْرًا كَرِيمًا“Salam penghormatan kepada mereka (orang-orang mukmin itu) pada hari mereka menemui-Nya ialah: Salam; dan Dia menyediakan pahala yang mulia bagi mereka.” (QS. Al-Ahzab: 44). Lihat Tafsir Al-Qur’an Al-‘Azhim, 6:348.Dalam Tafsir As-Sa’di(hlm. 739), Syaikh ‘Abdurrahman bin Nashir As-Sa’di rahimahullahmenerangkan bahwa ucapan salam ini adalah dari Allah kepada penduduk surga, itu adalah ucapan selamat untuk mereka penduduk surga. Jika Allah mengucapkan salam, maka penduduk surga mendapatkan keselamatan sempurna dari berbagai macam sisi. Juga mereka mendapatkan penghormatan, tidak ada penghormatan yang lebih tinggi daripada itu. Juga tidak ada kenikmatan yang luar biasa semisal itu. Karena penghormatan tersebut langsung dari Allah Yang Maha merajai, Rabb Yang Mahaagung, Rabb yang Maha Pengasih lagi Penyayang, itulah salam penghormatan untuk penduduk surga. Merekalah yang mendapatkan ridha Allah dan tidak mendapatkan murka sama sekali. Jika Allah berkehendak bagi penduduk surga bahwa mereka tidak akan mati atau hati mereka terus bersuka cita, pasti itu terjadi.Kita semua berharap agar tidak lepas dari berbagai kenikmatan di surga dan tidak terhalangi melihat wajah Allah Yang Mulia.Allah Ta’alaberfirman,
وَإِذَا حُيِّيتُمْ بِتَحِيَّةٍ فَحَيُّوا بِأَحْسَنَ مِنْهَا أَوْ رُدُّوهَا ۗإِنَّ اللَّهَ كَانَ عَلَىٰ كُلِّ شَيْءٍ حَسِيبًا“Apabila kamu diberi penghormatan dengan sesuatu penghormatan, maka balaslah penghormatan itu dengan yang lebih baik dari padanya, atau balaslah penghormatan itu (dengan yang serupa). Sesungguhnya Allah memperhitungankan segala sesuatu.” (QS. An-Nisa’: 86)Mengucapkan salam merupakan tanda cinta dan baiknya seorang muslim. Di dalamnya berisi:Semoga bermanfaat. Hanya Allah yang memberi taufik dan hidayah.—Diselesaikan di Darush Sholihin Panggang (Perpus Rumaysho), Rabu sore, 24 Dzulhijjah 1439 HOleh: Muhammad Abduh TuasikalArtikel Rumaysho.Com"
26,Faedah Sirah Nabi: Hijrah ke Habasyah Hingga Dua Kali,"Mereka meninggalkan Makkah menuju Asy-Syu’aibah(tempat di bagian selatan Jeddah). Ketika itu, ada yang menaiki kendaraan dan ada yang berjalan kaki. Allah memudahkan mereka dengan kedatangan dua kapal begitu mereka sampai di pelabuhan. Mereka berkata, “Kami sampai di Habasyah dan hidup dengan tenang, kami bebas beribadah dan menyembah Allah tanpa ada rintangan, kami tidak mendapatkan gangguan dan kami tidak pernah mendengar kata-kata yang membuat kami tidak senang.”Kejadian ini terjadi pada tahun kelima setelah kenabian. Setelah sebulan lebih, mereka kembali lagi ke Makkah.Gangguan dari orang-orang pasca pulangnya umat Islam dari Habasyah semakin menjadi-jadi. Akhirnya Rasulullah shallallahu ‘alaihi wa sallamkembali memerintahkan para sahabatnya untuk hijrah ke Habasyah. Mereka pun berhijrah yang jumlahnya sekitar 83 laki-laki dan 18 perempuan. Tatkala Quraisy mengetahui hijrah yang kedua ini, pada saat itulah, mereka mengirim beberapa orang terbaik mereka yaitu Amru bin Al-‘Ash dan ‘Abdullah bin Abi Rabi’ah, mereka juga mengirim hadiah yang bernilai tinggi untuk diberikan kepada Najasyi dan tokoh-tokoh agamanya serta para petinggi kerajaan. Setelah mereka sampai dan bermaksud menemui Najasyi yang sebelumnya mereka telah berikan sogokan kepada pejabat dan pemuka agama dengan tujuan agar tatkala terjadi dialog, maka mereka memberikan dukungan hingga maksud untuk mengeluarkan umat Islam dari lingkungan Najasyi bisa berjalan mulus.Hanya saja sikap raja Najasyi tidak semudah itu dalam menerima masukan. Ia menginginkan agar semua yang terlibat dalam masalah itu dipertemukan untuk mendengar alasan masing-masing. Umat Islam datang dan telah sepakat menunjuk Ja’far bin Abi Thalib radhiyallahu ‘anhusebagai juru bicara.Najasyi bertanya kepada umat Islam, “Agama baru apa yang kalian anut, yang menyebabkan kaum kalian terpecah dua, kalian tidak masuk ke dalam agama saya dan tidak masuk ke dalam salah satu agama yang ada.”Ja’far berkata, “Wahai paduka Raja, dulu kami adalah masyarakat yang hidup dalam kebodohan, kami menyembah patung dan memakan bangkai, melakukan perzinaan, memutuskan hubungan silaturahim, mengganggu tetangga, yang kuat di antara kami memeras yang lemah. Kondisi ini terjadi atas kami hingga Allah mengutus kepada kami seorang Rasul yang kami kenal dari nasab keturunan, kejujuran, amanah, hingga kesuciannya. Dia mengajak kami untuk menyembah Allah, tidak mempersekutukan-Nya dengan meninggalkan apa yang telah nenek moyang kami lakukan, seperti menyembah berhala dan batu ….”Dialog terus berlangsung antara Najasyi dan para sahabat radhiyallahu ‘anhum hingga berakhir dengan kegagalan misi dan tipu daya Quraisy dalam memulangkan umat Islam. Utusan itu kembali ke Makkah dengan membawa kekecewaan dan umat Islam semakin mendapatkan perlindungan yang kuat.Dari Ibnu Umar radhiyallahu ‘anhuma, ia berkata,لَعَنَ رَسُولُ اللَّهِ -صلى الله عليه وسلم- الرَّاشِىَ وَالْمُرْتَشِىَ.“Rasulullah shallallahu alaihi wa sallammelaknat orang yang memberi suap dan yang menerima suap”. (HR. Abu Daud no. 3580, Tirmidzi no. 1337, Ibnu Majah no. 2313. Kata Syaikh Al Albani hadits ini shahih).Dalam riwayat yang lain Nabi melaknat Ar-Ra-isy(الرَّائِشَ) yaitu penghubung antara penyuap dan yang disuap (HR. Ahmad, 5:279). Meski hadits ini lemah namun maknanya benar. Orang yang menjadi penghubung antara penyuap dan yang disuap berarti membantu orang untuk berbuat dosa dan ini adalah suatu yang terlarang. Hadits di atas menunjukkan bahwa suap termasuk dosa besar, karena ancamannya adalah laknat. Yaitu terjauhkan dari rahmat Allah. Bahkan sogok itu haram berdasarkan ijmak (kesepakatan ulama). Jadi terlarang, meminta suap, memberi suap, menerima suap, dan menjadi penghubung antara penyaup dan yang disuap.Wajib bagi yang menyogok bertaubat kepada Allah, berhenti dari perbuatan tersebut, bertekad tidak akan mengulanginya lagi di masa akan datang, lalu menyesal atas kesalahan yang pernah dilakukan.Jika wajib mengembalikan sogokan kepada pemiliknya dan ada uzur untuk sampainya harta tersebut padanya karena tidak diketahui lagi tempat yang punya harta tersebut, juga tidak diketahui ahli warisnya setelah lama mencari, maka harta tadi digunakan untuk sedekah atas niatan orang yang punya.Membersihkan diri dari harta risywah(sogokan) adalah dengan menyerahkan harta tersebut pada fakir, miskin, atau pada maslahat umum. Jika ada yang menikah lalu butuh biaya, ia bisa menolongnya juga dengan harta tersebut.Jika harta sogokan itu berupa benda, maka harta tersebut dikeluarkan, atau harta tersebut dijual, lalu hasil penjualannya atau nilainya yang dikeluarkan untuk keperluan di atas.Jika sogok itu bentuknya sampai melalaikan hak orang lain, maka wajib mengembalikan haknya atau meminta dihalalkan darinya, karena dosa yang terkait hak manusia tidaklah selesai taubatnya kecuali dengan cara demikian. Lihat bahasan Syaikh Muhammad Shalih Al-Munajjid dalam Fatwa Al-Islam Sual wa Jawab, no. 104241.Moga Allah beri hidayah.Berlanjut lagi pada pelajaran dari Kisah Hijrah ke Habasyah insya Allah.—Diselesaikan di Pesantren Darush Sholihin, Panggang, Gunungkidul,11 Muharram 1140 HOleh: Muhammad Abduh TuasikalArtikel Rumaysho.Com"
