,titles,cleaned_contents
43,Hadits Arbain #13: Mencintainya Seperti Mencintai Diri Sendiri,"Bagaimana cara kita mencintai saudara kita? Di sini dapat kita pelajari dari Hadits Arbain karya Imam Nawawi, no. 13.عَنْ أَبِي حَمْزَةَ أَنَسٍ بْنِ مَالِكٍ رَضِيَ اللهُ عَنْهُ – خَادِمِ رَسُوْلِ اللهِ صَلَّى اللهُ عَلَيْهِ وَسَلَّمَ – عَنِ النَّبِيِّ صَلَّى اللهُ عَلَيْهِ وَسَلَّمَ قَالَ: ” لاَ يُؤْمِنُ أَحَدُكُمْ حَتَّى يُحِبَّ لِأَخِيْهِ مَا يُحِبُّ لِنَفْسِهِ ” رَوَاهُ البُخَارِيُّ وَمُسْلِمٌDari Abu Hamzah Anas bin Malik radhiyallahu ‘anhu,pembantu Rasulullah shallallahu ‘alaihi wa sallam, dari Nabi shallallahu ‘alaihi wa sallambersabda, “Salah seorang di antara kalian tidaklah beriman (dengan iman sempurna) sampai ia mencintai saudaranya sebagaimana ia mencintai dirinya sendiri.” (HR. Bukhari dan Muslim)[HR. Bukhari, no. 13 dan Muslim, no. 45]Hadits di atas semakna dengan hadits dari Abdullah bin ‘Amr bin Al-‘Ash radhiyallahu ‘anhuma, Rasulullah shallallahu `alaihi wa sallambersabda,فَمَنْ أَحَبَّ أَنْ يُزَحْزَحَ عَنِ النَّارِ وَيَدْخُلَ الْجَنَّةَ فَلْتَأْتِهِ مَنِيَّتُهُ وَهُوَ يُؤْمِنُ بِاللَّهِ وَالْيَوْمِ الآخِرِ وَلْيَأْتِ إِلَى النَّاسِ الَّذِى يُحِبُّ أَنْ يُؤْتَى إِلَيْهِ“Barangsiapa ingin dijauhkan dari neraka dan masuk ke dalam surga, hendaknya ketika ia mati dalam keadaan beriman kepada Allah, dan hendaknya ia berperilaku kepada orang lain sebagaimana ia senang diperlakukan oleh orang lain.” (HR. Muslim, no. 1844)Mencintai bisa jadi berkaitan dengan urusan diin(agama), bisa jadi berkaitan dengan urusan dunia. Rinciannya sebagai berikut.1- Sangat suka jika dirinya mendapatkan kenikmatan dalam hal agama, maka wajib baginya mencintai saudaranya sebagaimana ia mencintai dirinya mendapatkan hal itu. Jika kecintaan seperti itu tidak ada, maka imannya berarti dinafikan sebagaimana disebutkan dalam hadits.Jika seseorang suka melakukan perkara wajib ataukah sunnah, maka ia suka saudaranya pun bisa melakukan semisal itu. Begitu pula dalam hal meninggalkan yang haram. Jika ia suka dirinya meninggalkan yang haram, maka ia suka pada saudaranya demikian. Jika ia tidak menyukai saudaranya seperti itu, maka ternafikan kesempurnaan iman yang wajib.Termasuk dalam hal pertama ini adalah suka saudaranya mendapatkan hidayah, memahami akidah, dijauhkan dari kebid’ahan, seperti itu dihukumi wajib karena ia suka jika ia sendiri mendapatkannya.2- Sangat suka jika dirinya memperoleh dunia, maka ia suka saudaranya mendapatkan hal itu pula. Namun untuk kecintaan kedua ini dihukumi sunnah. Misalnya, suka jika saudaranya diberi keluasan rezeki sebagaimana ia pun suka dirinya demikian, maka dihukumi sunnah. Begitu juga suka saudaranya mendapatkan harta, kedudukan, dan kenikmatan dunia lainnya, hal seperti ini dihukumi sunnah.Kita diperintahkan untuk mencintai sesama muslim. Allah Ta’alaberfirman,وَالْمُؤْمِنُونَ وَالْمُؤْمِنَاتُ بَعْضُهُمْ أَوْلِيَاءُ بَعْضٍ يَأْمُرُونَ بِالْمَعْرُوفِ وَيَنْهَوْنَ عَنِ الْمُنْكَرِ وَيُقِيمُونَ الصَّلَاةَ وَيُؤْتُونَ الزَّكَاةَ وَيُطِيعُونَ اللَّهَ وَرَسُولَهُ أُولَئِكَ سَيَرْحَمُهُمُ اللَّهُ إِنَّ اللَّهَ عَزِيزٌ حَكِيمٌ“Dan orang-orang yang beriman, lelaki dan perempuan, sebahagian mereka (adalah) menjadi penolong bagi sebahagian yang lain. Mereka menyuruh (mengerjakan) yang ma’ruf, mencegah dari yang munkar, mendirikan shalat, menunaikan zakat dan mereka taat pada Allah dan Rasul-Nya. Mereka itu akan diberi rahmat oleh Allah; sesungguhnya Allah Maha Perkasa lagi Maha Bijaksana.” (QS. At-Taubah: 71).Ibnu Rajab Al-Hambali berkata mengenai hadits di atas, “Di antara tanda iman yang wajib adalah seseorang mencintai saudaranya yang beriman lebih sebagaimana ia mencintai dirinya sendiri. Ia pun tidak ingin sesuatu ada pada saudaranya sebagaimana ia tidak suka hal itu ada padanya. Jika cinta semacam ini lepas, maka berkuranglah imannya.” (Jaami’ Al-‘Ulum wa Al-Hikam, 1:305).Sikap yang dilakukan oleh seorang muslim ketika melihat saudaranya yang melakukan kesalahan adalah menasihatinya. Ibnu Rajab Al-Hambali berkata, “Jika seseorang melihat pada saudaranya kekurangan dalam agama, maka ia berusaha untuk menasihatinya (membuat saudaranya jadi baik).” (Jaami’ Al-‘Ulum wa Al-Hikam, 1:308).Adapun jika muslim tersebut pelaku dosa besar seperti pemakan riba (rentenir) dan suka mengghibah (menggunjing), maka orang tersebut dicintai sekadar dengan ketaatan yang ada padanya dan dibenci karena maksiat yang ia terus lakukan.Ibnu Taimiyah rahimahullahberkata, “Jika ada dalam diri seseorang kebaikan dan kejelekan, dosa dan ketaatan, maksiat, sunnah dan bid’ah, maka kecintaan padanya tergantung pada kebaikan yang ia miliki. Ia pantas untuk dibenci karena kejelekan yang ada padanya. Bisa jadi ada dalam diri seseorang kemuliaan dan kehinaan, bersatu di dalamnya seperti itu. Contohnya, ada pencuri yang miskin. Ia berhak dihukumi potong tangan. Di samping itu ia juga berhak mendapat harta dari Baitul Mal untuk memenuhi kebutuhannya.” (Majmu’ah Al-Fatawa, 28:209).Ibnu Taimiyah melanjutkan, “Demikianlah prinsip Ahlus Sunnah wal Jama’ah. Prinsip diselisihi oleh Khawarij dan Mu’tazilah serta yang sepaham dengan mereka. Mereka menjadi hanya berhak dapat pahala saja. Atau jika tidak yah mendapatkan siksa saja. Sedangkan Ahlus Sunnah berprinsip bahwa Allah menyiksa orang yang berbuat dosa besar yang pantas untuk disiksa. Mereka pun dapat keluar dari neraka dengan syafa’at sebagai karunia dari Allah. Sebagaimana hal ini didukung oleh hadits dari Nabi shallallahu ‘alaihi wa sallam.” (Idem).Pertama: Yang dimaksud dalam hadits adalah tidak sempurnanya iman.Kedua: Wajib mencintai saudara kita sebagaimana mencintai saudara sendiri. Di sini dikatakan wajib karena ada kalimat penafian umum.Ketiga: Wajib meninggalkan hasad karena orang yang hasad pada saudaranya berarti tidak mencintai saudaranya seperti yang ia cintai pada dirinya sendiri. Bahkan orang yang hasad itu berangan-angan nikmat orang lain itu hilang.Sedangkan pengertian hasad menurut Syaikhul Islam Ibnu Taimiyah yaitu,الْحَسَدَ هُوَ الْبُغْضُ وَالْكَرَاهَةُ لِمَا يَرَاهُ مِنْ حُسْنِ حَالِ الْمَحْسُودِ“Hasad adalah membenci dan tidak suka terhadap keadaan baik yang ada pada orang yang dihasad.” (Majmu’ah Al-Fatawa, 10:111).1- Berkeinginan nikmat yang ada pada orang lain hilang meski tidak berpindah padanya. Orang yang hasad lebih punya keinginan besar nikmat orang lain itu hilang, bukan bermaksud nikmat tersebut berpindah padanya.2- Berkeinginan nikmat yang ada pada orang lain hilang lalu berkeinginan nikmat tersebut berpindah padanya. Misalnya, ada wanita cantik yang sudah menjadi istri orang lain, ia punya hasad seandainya suaminya mati atau ia ditalak, lalu ingin menikahinya. Atau bisa jadi pula ada yang punya kekuasaan atau pemerintahan yang besar, ia sangat berharap seandainya raja atau penguasa tersebut mati saja biar kekuasaan tersebut berpindah padanya.Tingkatan hasad kedua ini sama haramnya namun lebih ringan dari yang pertama.3- Tidak punya maksud pada nikmat orang lain, namun ia ingin orang lain tetap dalam keadaannya yang miskin dan bodoh. Hasad seperti ini membuat seseorang akan mudah merendahkan dan meremehkan orang lain.4- Tidak menginginkan nikmat orang lain hilang, namun ia ingin orang lain tetap sama dengannya. Jika keadaan orang lain lebih dari dirinya, barulah ia hasad dengan menginginkan nikmat orang lain hilang sehingga tetap sama dengannya. Yang tercela adalah keadaan kedua ketika menginginkan nikmat saudaranya itu hilang.5- Menginginkan sama dengan orang lain tanpa menginginkan nikmat orang lain hilang. Inilah yang disebut dengan ghibthohsebagaimana terdapat dalam hadits berikut.Dari ‘Abdullah bin Mas’ud radhiyallahu ‘anhu, ia berkata bahwa Rasulullah shallallahu ‘alaihi wa sallambersabda,لاَ حَسَدَ إِلاَّ فِى اثْنَتَيْنِ رَجُلٌ آتَاهُ اللَّهُ مَالاً فَسُلِّطَ عَلَى هَلَكَتِهِ فِى الْحَقِّ ، وَرَجُلٌ آتَاهُ اللَّهُ الْحِكْمَةَ ، فَهْوَ يَقْضِى بِهَا وَيُعَلِّمُهَا“Tidak boleh hasad (ghibtoh) kecuali pada dua orang, yaitu orang yang Allah anugerahkan padanya harta lalu ia infakkan pada jalan kebaikan dan orang yang Allah beri karunia ilmu (Al Qur’an dan As Sunnah), ia menunaikan dan mengajarkannya.” (HR. Bukhari, no. 73 dan Muslim, no. 816)Inilah maksud berlomba-lomba dalam kebaikan seperti dalam ayat,وَفِي ذَلِكَ فَلْيَتَنَافَسِ الْمُتَنَافِسُونَ“Dan untuk yang demikian itu hendaknya orang berlomba-lomba.” (QS. Al-Muthaffifin: 26)Semoga bermanfaat.Allahumma inna nas-aluka ‘ilman naafi’a.—Oleh: Muhammad Abduh TuasikalArtikel Rumaysho.Com"
44,Faedah Sirah Nabi: Pelajaran dari Hijrah ke Habasyah #01,"Ada beberapa pelajaran yang bisa diambil dari hijrah nabi ke Habasyah.Apa saja itu?Para sahabat Rasulullah shallallahu ‘alaihi wa sallamtidak mendapat kesempatan untuk bisa beribadah dengan baik dan tenang ketika berada di Makkah disebabkan gangguan yang datang dari tokoh-tokoh Quraisy. Hal ini memaksa mereka untuk meninggalkan sanak keluarga dan tanah air, demi sebuah akidah. Jika tidak, maka pilihannya adalah sebaliknya yaitu meninggalkan akidah demi harta keluarga dan tanah air. Akhirnya mereka memilih akidah, mereka memilih meninggalkan kampung halaman dan keluarga, demi menjaga agama mereka. Begitulah kedudukan sebuah akidah, dia berada di atas keluarga, harta, dan negeri.Kami beri contoh bagaimanakah para sahabat itu mempertahankan akidahnya, walau dipaksa oleh keluarga.Sa’ad bin Malik radhiyallahu ‘anhumembicarakan tentang ayat berikut ini,وَإِنْ جَاهَدَاكَ عَلَىٰ أَنْ تُشْرِكَ بِي مَا لَيْسَ لَكَ بِهِ عِلْمٌ فَلَا تُطِعْهُمَا ۖوَصَاحِبْهُمَا فِي الدُّنْيَا مَعْرُوفًا“Dan jika keduanya memaksamu untuk mempersekutukan dengan Aku sesuatu yang tidak ada pengetahuanmu tentang itu, maka janganlah kamu mengikuti keduanya, dan pergaulilah keduanya di dunia dengan baik.” (QS. Luqman: 15)Ia menyatakan bahwa ayat tersebut turun berkenaan dengan masalahnya. Ia katakan bahwa ia adalah anak yang sangat berbakti pada ibunya. Ketika ia masuk Islam, ibunya berkata, “Wahai Sa’ad apa lagi perkara baru yang kamu anut?” Ibunya melanjutkan, “Engkau mau tinggalkan agama baru yang kamu anut ataukah ibumu ini tidak makan dan tidak minum sampai meninggal dunia?” Maka ibu Sa’ad terus mencelanya karena keislamannya. Ada yang menegur Sa’ad, “Apa kamu tega mau membunuh ibumu?” Lantas Sa’ad berkata, “Ibuku jangalah lakukan seperti itu. Aku tetap tidak akan meninggalkan agamaku ini sama sekali.” Ibu Sa’ad terus berdiam sehari semalam, tanpa makan. Datang keesokan paginya, ibunya terus memaksa Sa’ad. Datang hari berikutnya pun tetap sama, ibunya terus memaksa. Ketika itu Sa’ad melihat keadaan ibunya lantas ia berkata, “Wahai ibu, andai engkau memiliki seratus nyawa, lalu nyawa tersebut keluar satu per satu, tetap aku tidak akan meninggalkan agamaku sedikit pun juga. Jika mau, silakan makan. Jika mau, silakan tidak makan.” Akhirnya ibunya pun makan. (HR. Thabrani dalam Kitab Al-‘Isyrah. Syaikh Musthafa Al-‘Adawi dalam Tafsir Al-Qur’an Al-‘Azhim, 11:61 mengatakan bahwa sanad hadits ini shahih).Kemudian apa yang pantas dikatakan kepada mereka sekarang yang meninggalkan negerinya untuk berhijrah ke negara-negara kafir atas dasar kekagumannya kepada kemajuan peradabannya (untuk mengais rezeki)? Coba bandingkan antara hijrah mereka dengan hijrah yang dilakukan para sahabat rasul ke negeri Habasyah yang bertujuan mencari tempat yang aman untuk beribadah kepada Allah Ta’ala Bersama sesama muslim, dan untuk membentuk masyarakat yang Islami; hidup berdampingan secara Islam dan lingkungan yang bernuansa Islam.Para sahabat Nabi yang berhijrah ke Habasyah itu telah memberikan pelajaran yang berharga kepada kita bahwa seorang muslim tidak mungkin bisa beradaptasi dengan lingkungan masyarakat non-muslim dalam hal-hal yang bertolak belakang dengan agama Islam. Justru semestinya muslimlah yang berupaya membimbing masyarakat non-muslim itu agar menjadi masyarakat yang Islami.Pelajaran ini juga berlaku pada pergaulan atau majelis pertemuan yang dilakukan oleh orang muslim dan ia menyaksikan kemungkaran di dalamnya. Maka bisa jadi ia mengikuti acara yang ada dan diam saja, sehingga ia harus melakukan upaya adaptasi dengan sesuatu yang bertentangan dengan agama Allah, atau ia menolak dan mengingkari hal tersebut dan jika tidak bisa melakukannya, maka ia keluar meninggalkan tempat pertemuan itu.Jadi, hijrah sahabat Rasul shallallahu ‘alaihi wa sallamke negeri Habasyah ini telah memberi pelajaran bagaimana sikap kita dalam berinteraksi dengan masyarakat non-muslim, bahkan lebih dari itu di sini terdapat pelajaran tentang sikap yang harus kita lakukan terhadap majelis pertemuan yang berisi kemaksiatan dan kemungkaran.Prinsip berlepas diri pada non-muslim yang diajarkan dalam Al-Qur’an seperti disebutkan dalam ayat,قَدْ كَانَتْ لَكُمْ أُسْوَةٌ حَسَنَةٌ فِي إِبْرَاهِيمَ وَالَّذِينَ مَعَهُ إِذْ قَالُوا لِقَوْمِهِمْ إِنَّا بُرَاء مِنكُمْ وَمِمَّا تَعْبُدُونَ مِن دُونِ اللَّهِ كَفَرْنَا بِكُمْ وَبَدَا بَيْنَنَا وَبَيْنَكُمُ الْعَدَاوَةُ وَالْبَغْضَاء أَبَداً حَتَّى تُؤْمِنُوا بِاللَّهِ وَحْدَهُ“Sesungguhnya telah ada suri tauladan yang baik bagimu pada Ibrahim dan orang-orang yang bersama dengan dia; ketika mereka berkata kepada kaum mereka : “Sesungguhnya kami berlepas diri daripada kamu dari daripada apa yang kamu sembah selain Allah, kami ingkari (kekafiran)mu dan telah nyata antara kami dan kamu permusuhan dan kebencian buat selama-lamanya sampai kamu beriman kepada Allah saja.” (QS. Al-Mumtahanah: 4)Di dalam ayat lain dijelaskan tentang prinsip untuk menjauhi tempat maksiat,وَالَّذِينَ لَا يَشْهَدُونَ الزُّورَ وَإِذَا مَرُّوا بِاللَّغْوِ مَرُّوا كِرَامًا“Dan orang-orang yang tidak memberikan menghadiri az-zuur, dan apabila mereka bertemu dengan (orang-orang) yang mengerjakan perbuatan-perbuatan yang tidak berfaedah, mereka lalui (saja) dengan menjaga kehormatan dirinya.” (QS. Al-Furqan: 72). Yang dimaksud menghadiri acara az-zuur adalah acara yang mengandung maksiat.Masih berlanjut insya Allah pada pelajaran lainnya dari hijrah ke negeri Habasyah. Semoga Allah mudahkan.Fikih Sirah Nabawiyah. Prof. Dr.Zaid bin Abdul Karim Az-Zaid. Penerbit Darus Sunnah.—Oleh: Muhammad Abduh TuasikalArtikel Rumaysho.Com"
45,Gate Ismail di Masjidil Haram,"Setiap waktu shalat di Gate Ismail selalu penuh dengan jamaah. Tempat ini jadi tempat spesial di #MasjidilHaram karena selepas shalat lima waktu akan dishalatkan jenazah di gate tersebut.Awalnya imam mengambil tempat shalat berjamaah di dekat Kabah. Setelah rampung shalat, imam beralih ke gate Ismail untuk menyolatkan jenazah. Jenazah bukan hanya satu, kadang empat bahkan bisa lebih dari itu. Pengurusan jenazah di #Makkah dan #Madinah selalu dipusatkan di masjid besar, bahkan ini berlaku di kota-kota lainnya di #saudiarabia.Tahukah apa yang terjadi setelah imam menyolatkan jenazah yang diikuti oleh ratusan ribu jamaah di #masjidilharammakkah?Imam beralih mundur ke belakang dan siap kembali ke tempattransit di dekat gate Ismail. Sedangkan jenazah jadi rebutan untuk diangkat oleh jamaah-jamaah yang menyolatkan.Di sinilah baru kami sadari kenapa gate Ismail jadi tempat rebutan jamaah yang ingin shalat. Ternyata mereka ingin rebutan memikul jenazah sampai ke mobil jenazah padahal jenazah yang ingin mereka pikul belum tentu mereka kenal, belum tentu kerabat mereka. Shalat Zhuhur tadi saja ada jenazah yang dalam keadaan kepalanya tidak tertutup kain kafan karena meninggal dunia saat ihram untuk umrah, itu pun jadi rebutan banyak orang untuk dipikul.Kita kadang menganggap memikul seperti ini hal biasa padahal Nabi shallallahu ‘alaihi wa sallam menjanjikan kepada siapa yang menyolatkan jenazah akan mendapatkan pahala satu qiroth. Lalu siapa yang ikut menguburkan jenazah, maka akan mendapatkan pahala dua qiroth. Nabi shallallahu ‘alaihi wa sallam sendiri menyatakan bahwa satu qiroth seperti ukuran gunung yang besar (kadang menyebutnya dengan Gunung Uhud), berarti pahala yang diperoleh banyak.Pelajaran penting, kapan kita mau berlomba dalam kebaikan seperti ini, bukan berlomba terus untuk dunia dan kejar harta?Peristiwa macam ini bisa kita saksikan kalau kita berada di Makkah atau Madinah. Semoga yang lainnya dimudahkan.Tinggal tunggu nih kapan yang belum umrah untuk berumah bersama Nur Ramadhan Wisata (CP: Mas Edi,‭083867838752‬)—@ Makkah, 11 Shafar 1440 H bada AsharAl-Faqir ila Maghfiroti Robbihi: Muhammad Abduh TuasikalArtikel Rumaysho.Com"
46,Faedah Sirah Nabi: Pelajaran dari Hijrah ke Habasyah #02,"Bagaimana pelajaran lainnya dari hijrah ke negeri Habasyah? Yuk pelajari lagi dari Faedah Sirah Nabi berikut ini.Pada peristiwa pengejaran yang dilakukan oleh kaum kafir Quraisy kepada para sahabat hingga ke negeri Habasyah dan upaya mereka untuk mengembalikan kaum muslimin ke Makkah lagi, hal tersebut menjadi indikasi yang sangat jelas bahwa pertentangan antara orang-orang kafir terhadap kaum muslimin tidaklah hanya bersifat pribadi, tetapi merupakan permusuhan yang didasari oleh keyakinan agama mereka. Karena seandainya permusuhan ini hanya bersifat pribadi, pastilah kaum kafir tersebut akan merasa senang dengan kepergian kaum muslimin dan jauh dari pandangan mereka. Jadi, benarlah bahwa permusuhan mereka itu berlatar belakang keyakinan agama. Ini menunjukkan bahwa orang yang berbeda agama dengan kita, ia tidak menginginkan kita hidup dengan aman dan tenteram untuk selamanya, di mana pun kita berada. Sedangkan orang yang bermusuhan secara pribadi dengan kita, maka ia berharap agar kita menjauh dari pandangannya, lalu ia melupakan kita.Allah Ta’alaberfirman tentang orang Yahudi dan Nashrani,وَلَنْ تَرْضَى عَنْكَ الْيَهُودُ وَلَا النَّصَارَى حَتَّى تَتَّبِعَ مِلَّتَهُمْ قُلْ إِنَّ هُدَى اللَّهِ هُوَ الْهُدَى وَلَئِنِ اتَّبَعْتَ أَهْوَاءَهُمْ بَعْدَ الَّذِي جَاءَكَ مِنَ الْعِلْمِ مَا لَكَ مِنَ اللَّهِ مِنْ وَلِيٍّ وَلَا نَصِيرٍ“Orang-orang Yahudi dan Nasrani tidak akan senang kepada kamu hingga kamu mengikuti agama mereka. Katakanlah: “Sesungguhnya petunjuk Allah itulah petunjuk (yang benar)”. Dan sesungguhnya jika kamu mengikuti kemauan mereka setelah pengetahuan datang kepadamu, maka Allah tidak lagi menjadi pelindung dan penolong bagimu.” (QS. Al-Baqarah: 120)Allah mengabarkan kepada Rasul-Nya, orang Yahudi dan Nashrani tidak akan ridha sampai kita mengikuti ajaran mereka. Karena mereka akan terus mengajak untuk mengikuti ajaran mereka dan mereka anggap itulah sebagai al-huda(petunjuk). Jadi, petunjuk Allah adalah ajaran yang dibawa Nabi Muhammad shallallahu ‘alaihi wa sallam, itulah petunjuk yang sebenarnya.Perlu dipahami, ajaran Yahudi dan Nashrani hanyalah mengikuti hawa nafsu semata sehingga disebutkan dalam ayat (yang artinya), “Dan sesungguhnya jika kamu mengikuti kemauan mereka setelah pengetahuan datang kepadamu, maka Allah tidak lagi menjadi pelindung dan penolong bagimu.” (QS. Al-Baqarah: 120)Maka ayat di atas menunjukkan larangan mengikuti hawa nafsu Yahudi dan Nashrani. Juga dalam ayat itu terdapat larangan untuk tasyabbuh dengan Yahudi dan Nashrani (meniru-niru mereka, pen.), begitu pula secara khusus tidak boleh meniru ajaran mereka.Walau larangan di atas ditujukan kepada Rasulullah shallallahu ‘alaihi wa sallam, namun umatnya pun tetap termasuk di dalamnya. Karena yang kita lihat adalah makna, bukan melihat siapa yang ditujukan pembicaraan tersebut. Sebagaimana ada kaedah, “Al-‘ibrah bi ‘umumil lafzhi, laa bi khushushis sabaab(dari lafazh umum itu yang diambil pelajaran, bukan semata-mata dilihat dari kekhususan sebab semata).” Demikian penjelasan dari Syaikh As-Sa’di dalam Tafsir As-Sa’di, hlm. 53.Utsman bin Hasan mengatakan, generasi salaf dahulu ketika ditanya tentang suatu masalah akidah, maka mereka menjawab dengan dalil Al-Qur’an dan As-Sunnah. Hal itu pula yang dilakukan oleh Ja’far bin Abu Thalib radhiyallahu ‘anhudi hadapan raja Habasyah, An-Najasyi, ketika ia menanyakan tentang hakikat Nabi Isa ‘alaihis salam. Maka Ja’far menjawabnya dengan ayat-ayat yang disebutkan dalam surah Maryam, sehingga Najasyi pun menangis hingga janggutnya basah, lantas ia memahami hakikat Isa sebenarnya, yang membuat ia kemudian masuk Islam.Misal yang disebutkan dalam surah Maryam tentang Nabi Isa ‘alaihis salam,قَالَ إِنِّي عَبْدُ اللَّهِ آتَانِيَ الْكِتَابَ وَجَعَلَنِي نَبِيًّاوَجَعَلَنِي مُبَارَكًا أَيْنَ مَا كُنْتُ وَأَوْصَانِي بِالصَّلَاةِ وَالزَّكَاةِ مَا دُمْتُ حَيًّاوَبَرًّا بِوَالِدَتِي وَلَمْ يَجْعَلْنِي جَبَّارًا شَقِيًّاوَالسَّلَامُ عَلَيَّ يَوْمَ وُلِدْتُ وَيَوْمَ أَمُوتُ وَيَوْمَ أُبْعَثُ حَيًّاذَٰلِكَ عِيسَى ابْنُ مَرْيَمَ ۚقَوْلَ الْحَقِّ الَّذِي فِيهِ يَمْتَرُونَمَا كَانَ لِلَّهِ أَنْ يَتَّخِذَ مِنْ وَلَدٍ ۖسُبْحَانَهُ ۚإِذَا قَضَىٰ أَمْرًا فَإِنَّمَا يَقُولُ لَهُ كُنْ فَيَكُونُ
وَإِنَّ اللَّهَ رَبِّي وَرَبُّكُمْ فَاعْبُدُوهُ ۚهَٰذَا صِرَاطٌ مُسْتَقِيمٌSebagaimana pelajaran dari kisah hijrah ke Habasyah ini, boleh bagi kaum muslimin meminta pertolongan kepada orang kafir dengan memenuhi dua syarat:Masih berlanjut insya Allah pada pelajaran lainnya dari hijrah ke negeri Habasyah. Semoga Allah mudahkan.—Oleh: Muhammad Abduh TuasikalArtikel Rumaysho.Com"
